title,date,link,content
"
Kiongozi wa Korea Kaskazini aelekea Urusi
","Jumatatu , 11th Sep , 2023",https://www.eatv.tv/news/current-affairs/kiongozi-wa-korea-kaskazini-aelekea-urusi,"  Kiongozi wa Korea Kaskazini Kim Jong Un ameripotiwa kuanza safari yake ya kuelekea Vladivostok kwa mkutano wa kilele na Rais wa Urusi Vladimir Putin. Treni hiyo ya kivita ambayo Kim anaitumia kwa ziara za kigeni inaonekana kuondoka Pyongyang, vyombo vya habari vya Korea Kusini vimeripoti vikimnukuu afisa wa serikali. Mkutano huo unatarajiwa kufanyika mapema siku ya Jumanne.Shirika la habari la Urusi Interfax limeripoti mapema kwamba Kim anatarajiwa kuzuru ""katika siku zijazo"". Iwapo mkutano huo na Putin utafanikiwa, itakuwa ni ziara ya kwanza ya kimataifa ya kiongozi huyo wa Korea Kaskazini katika kipindi cha zaidi ya miaka minne, na ya kwanza tangu janga la virusi vya corona. Viongozi hao wawili huenda wakajadili uwezekano wa Korea Kaskazini kuipatia Moscow silaha za kusaidia vita vyake nchini Ukraine, afisa wa Marekani awali aliiambia BBC mshirika wa Marekani CBS. Ziara ya mwisho ya Kim nje ya nchi ilikuwa Vladivostok mwaka 2019 kwa mkutano wake wa kwanza na Putin baada ya kuvunjika kwa mazungumzo ya Korea Kaskazini ya kuachana na silaha za nyuklia na rais wa wakati huo Donald Trump. Kim pia alisafiri kwenda Vladivostok kwa treni mwaka 2019. Rais wa Jamhuri ya Muungano wa Tanzania Samia Suluhu Hassan, Nyama Safari Manjala 
 Rais wa Jamhuri ya Muungano wa Tanzania Samia Suluhu Hassan, Kwenye picha kuanzia kushoto ni Jay Melody, Alikiba na Rayvanny Nyama Maua ©  East Africa Television Limited. All Rights Reserved"
"
Shambulizi la bomu laua 16 Ukraine, yumo mtoto
","Jumatano , 6th Sep , 2023",https://www.eatv.tv/news/current-affairs/shambulizi-la-bomu-laua-16-ukraine-yumo-mtoto,"  Takriban watu 16 wameuawa katika shambulio la kombora katika mji wa Kostyantynivka nchini Ukraine. Rais Volodymyr Zelensky, ambaye aliilaumu Urusi, alisema waliouawa ni watu ambao hawakufanya kosa lolote na kuonya kuwa idadi ya vifo inaweza kuongezeka.  Video zinazosambaa kwenye mitandao ya kijamii zinaonekana kuonyesha wakati wa mlipuko huo na matokeo yake ya picha.  Kostyantynivka, katika mkoa wa mashariki mwa Ukraine wa Donetsk, iko karibu na mstari wa mbele. Rais Zelensky amesema ""Uovu huu wa Urusi lazima ushindwe haraka iwezekanavyo,"" . Mamlaka mjini Moscow bado hazijatoa tamko lolote kuhusu madai hayo. Miongoni mwa watu 16 waliofariki ni mtoto, huku wengine 20 wakidhaniwa kujeruhiwa, kwa mujibu wa taarifa zilizosambazwa na Waziri Mkuu wa Ukraine Denys Shmyhal. Soko, maduka na maduka ya dawa yanaripotiwa kukumbwa na hitilafu.Video zinazosambaa kwenye mitandao ya kijamii zinaonekana kuonyesha wakati wa mlipuko huo na matokeo yake ya picha. Tukio hilo limejiri katika barabara yenye shughuli nyingi wakati watu walikuwa wakimiminika kwenye vibanda vya soko na mitaro ya mikahawa. Maafisa nchini Urusi bado hawajadai kuhusika na shambulio hilo. Awali walikanusha kuwalenga raia kama sehemu ya mashambulizi yao.Shambulio hilo la Jumatano lilienda sambamba na ziara ya Waziri wa Mambo ya Nje wa Marekani Antony Blinken katika mji mkuu wa Ukraine, Kyiv, ambako alitarajiwa kukutana na Bw Zelensky. Katibu Mtendaji wa Baraza la Mitihani Tanzania (NECTA), Dkt. Said Mohamed Eneo la ajali Bangi Rais wa Jamhuri ya Muungano wa Tanzania Samia Suluhu Hassan, 
 Eneo la ajali Rais wa Jamhuri ya Muungano wa Tanzania Samia Suluhu Hassan, Bangi Katibu Mtendaji wa Baraza la Mitihani Tanzania (NECTA), Dkt. Said Mohamed Nyama ©  East Africa Television Limited. All Rights Reserved"
"
Kim Jong Un na Putin kukutana mwezi huu
","Jumanne , 5th Sep , 2023",https://www.eatv.tv/news/current-affairs/kim-jong-un-na-putin-kukutana-mwezi-huu,"  Kiongozi wa Korea Kaskazini Kim Jong Un anapanga kusafiri kwenda Urusi mwezi huu kukutana na Rais Vladimir Putin, kwa mujibu wa taarifa ya afisa mmoja wa Marekani  Viongozi hao wawili watajadili uwezekano wa Korea Kaskazini kuipatia Moscow silaha za kusaidia vita vyake nchini Ukraine, afisa huyo alisema.Ambapo mazungumzo yatafanyika sehemu isiyojulikana. 
	Msemaji wa Kremlin hakuwa na cha kusema juu ya ripoti hizo, ambazo pia zilibebwa na vyombo vingine vya habari vya Marekani. Hakuna tamko lolote la haraka kutoka Korea Kaskazini. 
	Vyanzo vya habari vimeliambia gazeti la New York Times kwamba Kim alikuwa na uwezekano mkubwa wa kusafiri kwa kutumia treni ya kivita. 
	Mkutano huo unakuja baada ya Ikulu ya White House kusema ina taarifa mpya kwamba mazungumzo ya silaha kati ya nchi hizo mbili yanaendelea. 
	Msemaji wa Baraza la Usalama la Taifa John Kirby amesema Waziri wa Ulinzi wa Urusi, Sergei Shoigu, alijaribu kuishawishi Pyongyang kuuza silaha za kivita kwa Urusi wakati wa ziara yake ya hivi karibuni nchini Korea Kaskazini. Katibu Mtendaji wa Baraza la Mitihani Tanzania (NECTA), Dkt. Said Mohamed Eneo la ajali Bangi Rais wa Jamhuri ya Muungano wa Tanzania Samia Suluhu Hassan, 
 Eneo la ajali Rais wa Jamhuri ya Muungano wa Tanzania Samia Suluhu Hassan, Bangi Katibu Mtendaji wa Baraza la Mitihani Tanzania (NECTA), Dkt. Said Mohamed Nyama ©  East Africa Television Limited. All Rights Reserved"
"
Rais wa Urusi ahutubia bila kutaja ajali ya ndege
","Alhamisi , 24th Aug , 2023",https://www.eatv.tv/news/current-affairs/rais-wa-urusi-ahutubia-bila-kutaja-ajali-ya-ndege,"  Mkuu wa kundi la mamluki la Wagner Yevgeny Prigozhin anadhaniwa kuwa aliuawa katika ajali ya ndege kaskazini mwa Moscow, pamoja na mtu wake wa  karibu Dmitry Utkin na wengine wanane.  Rais Volodymyr Zelensky ameliambia shirika la habari la Interfax-Ukraine kwamba Ukraine haikuhusika katika kifo cha bosi wa Wagner Yevgeny Prigozhin Ndege hiyo inayomilikiwa na Prigozhin, ilikuwa na abiria saba na wafanyakazi watatu wakati ilipoanguka katika eneo la Tver. Miili yote 10 imepatikana, ripoti zinasema Kufuatia ajali hiyo na vifo hivyo kumekua na mshangao baada ya Rais wa Urusi Vladimir Putin wa Urusi  kutotaja ajali hiyo wakati akihutubia mkutano wa kimataifa kwa njia ya video. Hata ikulu ya Kremlin bado haijasema lolote kuhusu ajali ya ndege ya Jumatano ambapo kiongozi wa Wagner Yevgeny Prigozhin anadhaniwa kuwa amefariki dunia. Kuna uvumi mkubwa juu ya kile kilichotokea. Vyanzo vya ulinzi vya Uingereza vinaiambia BBC kuwa shirika la ujasusi la Urusi FSB lina uwezekano mkubwa wa kuwajibika. Wakati huo huo , Rais Volodymyr Zelensky ameliambia shirika la habari la Interfax-Ukraine kwamba Ukraine haikuhusika katika kifo cha bosi wa Wagner Yevgeny Prigozhin. Rais huyo amesema nchi yake haijahusika na suala hilo na kwamba  anatambua ni nani ana uhusiano na suala  hilo Katibu Mtendaji wa Baraza la Mitihani Tanzania (NECTA), Dkt. Said Mohamed Eneo la ajali Bangi Rais wa Jamhuri ya Muungano wa Tanzania Samia Suluhu Hassan, 
 Eneo la ajali Rais wa Jamhuri ya Muungano wa Tanzania Samia Suluhu Hassan, Bangi Katibu Mtendaji wa Baraza la Mitihani Tanzania (NECTA), Dkt. Said Mohamed Nyama ©  East Africa Television Limited. All Rights Reserved"
"
Watano wauawa kwa kombora Ukraine
","Jumamosi , 19th Aug , 2023",https://www.eatv.tv/news/current-affairs/watano-wauawa-kwa-kombora-ukraine,"  Watu watano wameuawa na wengine 37 kujeruhiwa wakati kombora la Urusi lilipoupiga mji wa kaskazini mwa Ukraine wa Chernihiv, wizara ya mambo ya ndani ya Ukraine imesema.  Watoto 11 ni miongoni mwa waliojeruhiwa. Uwanja mkuu, jengo la chuo kikuu na ukumbi wa michezo umeripotiwa kuharibiwa. 
	Rais Volodymyr Zelensky aliweka video fupi inayoonyesha magari yaliyoharibiwa na majengo yakiwa yamejaa vifusi. Mwili mmoja pia unaweza kuonekana kwa muda mfupi.Chernihiv iko karibu na mpaka wa Belarus. Ilikaliwa na Urusi mwanzoni mwa uvamizi huo, lakini baadaye ikachukuliwa tena na wanajeshi wa Ukraine. 
	""Kombora la Urusi lilipiga katikati ya mji, katika Chernihiv yetu. Mraba, chuo kikuu cha polytechnic, ukumbi wa michezo, ""Rais Zelensky aliandika kwenye Telegram.""Jumamosi ya kawaida, ambayo Urusi iligeuka kuwa siku ya maumivu na kupoteza. Kuna watu wamekufa, kuna majeruhi,"" aliongeza.
	  Katibu Mtendaji wa Baraza la Mitihani Tanzania (NECTA), Dkt. Said Mohamed Eneo la ajali Bangi Rais wa Jamhuri ya Muungano wa Tanzania Samia Suluhu Hassan, 
 Eneo la ajali Rais wa Jamhuri ya Muungano wa Tanzania Samia Suluhu Hassan, Bangi Katibu Mtendaji wa Baraza la Mitihani Tanzania (NECTA), Dkt. Said Mohamed Nyama ©  East Africa Television Limited. All Rights Reserved"
"
Nimesikia kilio cha viongozi wa Afrika - Putin
","Ijumaa , 28th Jul , 2023",https://www.eatv.tv/news/current-affairs/nimesikia-kilio-cha-viongozi-wa-afrika-putin,"  Rais wa Urusi Vladimir Putin amewaambia viongozi wa Afrika Ijumaa ya leo mjini Moscow kuwa  anaheshimu pendekezo lao la amani kuhusu Ukraine na alikuwa akilichunguza kwa makini  Putin pia ameuambia mkutano wa kilele wa Urusi na Afrika kwamba Urusi inaongeza usambazaji wa chakula kwa Afrika, ikiwa ni pamoja na usafirishaji wa nafaka bila malipo ambayo alitangaza siku moja kabla, na ina nia ya kuendeleza ushirikiano wa kijeshi na bara hilo 
	Viongozi wa Afrika waliwasilisha mpango wao wa amani mwezi uliopita kwa Putin na Rais wa Ukraine Volodymyr Zelenskiy lakini umeshindwa kupata maelewano na pande zote mbili.
	  Katibu Mtendaji wa Baraza la Mitihani Tanzania (NECTA), Dkt. Said Mohamed Eneo la ajali Bangi Rais wa Jamhuri ya Muungano wa Tanzania Samia Suluhu Hassan, 
 Eneo la ajali Rais wa Jamhuri ya Muungano wa Tanzania Samia Suluhu Hassan, Bangi Katibu Mtendaji wa Baraza la Mitihani Tanzania (NECTA), Dkt. Said Mohamed Nyama ©  East Africa Television Limited. All Rights Reserved"
"
Urusi yashambulia hifadhi ya nafaka Ukraine
","Jumatano , 19th Jul , 2023",https://www.eatv.tv/news/current-affairs/urusi-yashambulia-hifadhi-ya-nafaka-ukraine,"  Mashambulizi ya makombora ya Urusi katika pwani ya Bahari Nyeusi ya Ukraine yameharibu tani 60,000 za nafaka na kuharibu miundombinu ya kuhifadhia, maafisa wanasema.   Waziri wa Kilimo Mykola Solskyi alisema kiasi kinachofikiriwa cha miundombinu ya kuuza nje ilikuwa haifanyi kazi. Urusi imejiondoa katika mkataba wa kimataifa wa nafaka tangu majira ya joto mwaka jana, na kuhakikisha njia salama ya usafirishaji wa bidhaa za nje katika Bahari Nyeusi.Kremlin ilisema madai yake ya mauzo ya nje ya Urusi hayakuheshimiwa. Ndani ya saa kadhaa baada ya kujiondoa katika mkataba wa nafaka siku ya Jumatatu. Urusi ilipiga miji ya bandari ya kusini ya Odesa na Mykolaiv mapema Jumanne. Ilifuatia mashambulizi zaidi usiku wa Jumatano, ikilenga vituo vya nafaka na miundombinu ya bandari huko Odesa na zaidi chini ya pwani ya Bahari Nyeusi huko Chornomorsk, bandari mbili kati ya tatu ambazo zilijumuishwa katika mpango wa kuuza nje. Katibu Mtendaji wa Baraza la Mitihani Tanzania (NECTA), Dkt. Said Mohamed Eneo la ajali Bangi Rais wa Jamhuri ya Muungano wa Tanzania Samia Suluhu Hassan, 
 Eneo la ajali Rais wa Jamhuri ya Muungano wa Tanzania Samia Suluhu Hassan, Bangi Katibu Mtendaji wa Baraza la Mitihani Tanzania (NECTA), Dkt. Said Mohamed Nyama ©  East Africa Television Limited. All Rights Reserved"
"
Ramphosa amwambia Putin vita lazima viishe
","Jumapili , 18th Jun , 2023",https://www.eatv.tv/news/current-affairs/ramphosa-amwambia-putin-vita-lazima-viishe,"  Rais wa Afrika Kusini Cyril Ramaphosa  ambaye yuko nchini Urusi kama sehemu ya ujumbe wa kutafuta amani amemwambia mwenzake wa Urusi Vladimir Putin kwamba vita vya Ukraine lazima vikome.  Ramaphosa ameweka wazi nukta 10 za mpango wa amani wa Afrika ambao unatafuta makubaliano ya hatua za kujenga amani hata kama Ukraine wiki iliyopita ilianza mashambulizi ya kukabiliana na kuvirudisha nyuma vikosi vya Urusi ""Vita hivi lazima viwe na mwisho, lazima vitatuliwe kwa njia ya mazungumzo na kidiplomasia,"" Amesema Ramaphosa akiwa huko St Petersburg Jumamosi . Wataalamu wa siasa za kimataifa wanasema Ujumbe huu una umuhimu maalum kwa Afrika ambayo inategemea usambazaji wa chakula na mbolea kutoka Urusi na Ukraine. Vita hivyo vimezuia uletaji wa bidhaa za ngano ambayo huzalishwa kwa wingi  na nchi hizo mbili. Putin alikatiza hotuba ya ufunguzi ya viongozi wa Afrika wanaotaka kupatanisha mzozo huo ili kutoa sababu kwa nini aliamini mapendekezo yao mengi yalikuwa potofu.Alisisitiza msimamo wake kuwa Ukraine na nchi za Magharibi zilianzisha mzozo muda mrefu kabla ya Urusi kutuma vikosi vyake vya kijeshi kwenye mpaka mwezi Februari mwaka jana. Alisema Urusi haijawahi kukataa mazungumzo na upande wa Ukraine, ambao ulikuwa umezuiwa na Kyiv. Licha ya ujumbe huo wa Afrika katika nchi mbili zinazohasimiana, wataalamu wa siasa za kikanda wanaona kuwa nafasi ya mazungumzo ya amani bado ni finyu huku Ukraine na Urusi zikichukua misimamo tofauti kabisa. Ukraine inaitaka Urusi iondoe wanajeshi wake katika maeneo yake yote inayokalia kama sharti la mazungumzo ya amani. Kremlin kwa upande wake, inataka Ukraine itambue Rasi ya Crimea ambayo Moscow ilinyakua kinyume cha sheria kutoka kwa Ukraine mwaka 2014 kama sehemu ya Urusi na kutambua mafanikio mengine ya ardhi ambayo imepata. Katibu Mtendaji wa Baraza la Mitihani Tanzania (NECTA), Dkt. Said Mohamed Eneo la ajali Bangi Rais wa Jamhuri ya Muungano wa Tanzania Samia Suluhu Hassan, 
 Eneo la ajali Rais wa Jamhuri ya Muungano wa Tanzania Samia Suluhu Hassan, Bangi Katibu Mtendaji wa Baraza la Mitihani Tanzania (NECTA), Dkt. Said Mohamed Nyama ©  East Africa Television Limited. All Rights Reserved"
"
Viongozi saba wa Afrika wawasili Ukraine
","Ijumaa , 16th Jun , 2023",https://www.eatv.tv/news/current-affairs/viongozi-saba-wa-afrika-wawasili-ukraine,"  Viongozi wa Afrika wapo nchini  Ukraine katika ujumbe wa amani ambapo wanatarajiwa kukutana na Rais Volodymyr Zelensky. Viongozi saba wa Afrika, kutoka nchi kama Afrika Kusini na Misri, wataelekea Urusi hadi kesho. Kundi hilo limekubaliana kushirikiana na Zelensky na Putin juu ya usitishaji mapigano na amani ya kudumu.  Lakini mpango huo unakuja wakati Kyiv inazindua mashambulizi yake dhidi ya uvamizi wa Urusi na mapigano yanaongezeka. Pia Ujumbe wa viongozi wa Afrika utakutana na Rais Zelensky baadaye leo kabla ya kufanya mkutano na vyombo vya habari. Waziri wa Mambo ya Nje wa Ukraine Dmytro Kuleba ameandika kwenye ukurasa wake wa Twitter kwa lugha ya Kiingereza akisema mashambulizi ya Urusi yaliyofanywa leo  yanayoilenga Kyiv, na ni ujumbe kwa viongozi wa Afrika wanaozuru Ukraine leo:  Wakati hayo yakijiri Rais wa Urusi Vladimir Putin amezungumza katika mkutano wa kimataifa wa kiuchumi wa St Petersburg . Katibu Mtendaji wa Baraza la Mitihani Tanzania (NECTA), Dkt. Said Mohamed Eneo la ajali Bangi Rais wa Jamhuri ya Muungano wa Tanzania Samia Suluhu Hassan, 
 Eneo la ajali Rais wa Jamhuri ya Muungano wa Tanzania Samia Suluhu Hassan, Bangi Katibu Mtendaji wa Baraza la Mitihani Tanzania (NECTA), Dkt. Said Mohamed Nyama ©  East Africa Television Limited. All Rights Reserved"
"
Mwandishi wa Ufaransa auawa Ukraine
","Jumatano , 10th Mei , 2023",https://www.eatv.tv/news/current-affairs/mwandishi-wa-ufaransa-auawa-ukraine,"  Shirika la Habari la Kimataifa la Ufaransa A FP limesema mwandishi wake Arman Soldin ameuwawa kwa shambulio la roketi karibu na mji wa Bakhmut mashariki mwa Ukraine.  Kupitia ukurasa wake wa Twitter Shirika la Habari la Kimataifa la Ufaransa A FP limesema mratibu wake wa video wa Ukraine, Arman Soldin ameuwawa kwa shambulio la roketi karibu na mji wa Bakhmut mashariki mwa Ukraine. Baadae shirika hilo lilitoa taarifa yenye kusema mkasa huo ulitokea jioni ya Jumanne katika mji uitwao Chasiv Yar, ulio karibu na Bakhmut. Soldin alikuwa na umri wa miaka 32 na alizaliwa Sarajevo, eneo ambalo kwa wakati huu ni mji mkuu wa Bosnia. Vikosi vya Urusi vimekuwa vikijaribu kuuteka mji huo kwa muda wa miezi tisa, na hivyo kuufanya kuwa eneo la makabiliano ya kivita la muda mrefu zaidi nchini Ukraine. Bakhmut katika kipindi cha makabiliano ya vita virefu zaidi. Itakumbukwa Mei 2022, mwandishi wa habari mwingine wa Ufaransa Frederic Leclerc-Imhoff, ambaye alikuwa kufanya kazi katika kituo cha televisheni cha Ukraine BFM-TV, aliuawa karibu mji wa Severodonetsk hukohuko mashariki mwa Ukraine.   Katibu Mtendaji wa Baraza la Mitihani Tanzania (NECTA), Dkt. Said Mohamed Eneo la ajali Bangi Rais wa Jamhuri ya Muungano wa Tanzania Samia Suluhu Hassan, 
 Eneo la ajali Rais wa Jamhuri ya Muungano wa Tanzania Samia Suluhu Hassan, Bangi Katibu Mtendaji wa Baraza la Mitihani Tanzania (NECTA), Dkt. Said Mohamed Nyama ©  East Africa Television Limited. All Rights Reserved"
"
Urusi kulipa kisasi,Marekani yahusishwa.
","Ijumaa , 5th Mei , 2023",https://www.eatv.tv/news/current-affairs/urusi-kulipa-kisasimarekani-yahusishwa,"  Waziri wa Mambo ya Nje wa Urusi Sergei Lavrov amesema shambulizi la ndege isiyo na rubani katika ikulu ya Urusi, Kremlin, kilikuwa ""kitendo cha uhasama"" na nchi hiyo itajibu kwa kuchukua hatua madhubuti.  Urusi inaishutumu Ukraine kwa kurusha ndege hiyo katika ikulu ya Kremlin katika jaribio la kumuua Rais Vladmir Putin.Urusi imesema Marekani inahusika kupanga shambulizi hilo. Akizungumza leo na waandishi habari nchini India, Lavrov amesema ni wazi kwamba ""magaidi wa Ukraine wasingeweza kufanya hivyo peke yao bila Marekani kufahamu."" Hata hivyo, Ukraine imekanusha madai hayo na Marekani imeyapuuza ikisema ni ya ""uongo"". Wakati huo huo, kiongozi wa kundi binafsi la kijeshi la Urusi, Wagner, Yevgeny Prigozhin amesema kikosi chake kitaondoka Bahkmut, Ukraine Mei 10. Prigozhin amesema leo kuwa wataondoka kwa sababu ya kupoteza wapiganaji wake wengi na ukosefu wa silaha. Katibu Mtendaji wa Baraza la Mitihani Tanzania (NECTA), Dkt. Said Mohamed Eneo la ajali Bangi Rais wa Jamhuri ya Muungano wa Tanzania Samia Suluhu Hassan, 
 Eneo la ajali Rais wa Jamhuri ya Muungano wa Tanzania Samia Suluhu Hassan, Bangi Katibu Mtendaji wa Baraza la Mitihani Tanzania (NECTA), Dkt. Said Mohamed Nyama ©  East Africa Television Limited. All Rights Reserved"
"
Tuhuma za siri kwa Urusi kuhusu Ukraine
","Ijumaa , 5th Mei , 2023",https://www.eatv.tv/news/current-affairs/tuhuma-za-siri-kwa-urusi-kuhusu-ukraine,"  Mashirika ya kijasusi ya Ukraine yaliripoti wiki hii kwamba yalifichua mpango wa kusafirisha injini za ndege ya kijeshi ya An-74 kutoka Ukraine hadi Iran.wachunguzi wa Ukraine wanadai kwamba Iran imekuwa ikitumika kama nchi ya kati tu ilhali Urusi anaweza kuwa mnunuzi halisi.  Habari hii ilianza mwaka 2011, wakati shirika la ndege la Lviv Airlines lilifutiliwa mbali nchini Ukraine. Kisha mali zote za shirika hili la ndege zilipaswa kuhamishiwa kwenye mfuko wa mali ya serikali, lakini kulikuwa na usiri mkubwa hali ya kwamba serikali ilifichwa huku sehemu ya mali ya shirika hilo ikipelekwa katika mikoa mingine kwa uuzaji zaidi. Vipuri vya ndege nchini Ukraini viko chini ya udhibiti wa mauzo ya nje, kwa hivyo haingewezekana kuviuza hivyo hivyo. Walipanga kuvificha na kuvitoa nje chini ya vipengele vya mabomba ya gesi kwa kutumia nyaraka za kughushi. Kwa hili, wanunuzi wa kigeni waliahidi kulipa $ 400,000 kwa kila injini. Kulingana na vyanzo vya mamlaka ya uchunguzi, hii inaweza kuwa mpango wa magendo kwa ajili ya kusafirisha bidhaa za kijeshi kutoka Ukraine hadi Urusi kupitia nchi tatu. Kwa uwezekano wote, ununuzi huo ulikusudiwa kwa ndege za usafirishaji wa jeshi la Urusi. D-36 ni injini ya ndege ya turbojet yenye mzunguko wa pande mbili, iliyozalishwa kwa wingi katika kiwanda cha Zaporizhzhya Motor Sich mnamo 1977 kwa ajili ya ndege ya Antonov. An-74 ni muundo wa polar wa ndege ya usafirishaji ya An-72, ndege iliyofanikiwa sana ya usafirishaji na nyepesi iliyotengenezwa katika Ofisi ya Ubunifu ya Antonov miaka ya 1970. Kwa sababu ya kumiliki eneo lisilo la kawaida la injini juu ya ndege, ndege hii inaweza kutua kwenye njia ndogo,ambazo ni duni. Katibu Mtendaji wa Baraza la Mitihani Tanzania (NECTA), Dkt. Said Mohamed Eneo la ajali Bangi Rais wa Jamhuri ya Muungano wa Tanzania Samia Suluhu Hassan, 
 Eneo la ajali Rais wa Jamhuri ya Muungano wa Tanzania Samia Suluhu Hassan, Bangi Katibu Mtendaji wa Baraza la Mitihani Tanzania (NECTA), Dkt. Said Mohamed Nyama ©  East Africa Television Limited. All Rights Reserved"
"
Shambulizi la kumuua Putin lakwama
","Alhamisi , 4th Mei , 2023",https://www.eatv.tv/news/current-affairs/shambulizi-la-kumuua-putin-lakwama,"  Picha ya vidio inayoonyesha droni ikilipuka juu ya Kremlin katika shambulio linalodaiwa kufanywa na Ukraine dhidi ya Rais wa Urusi imesambazwa Jumatano na mitandao kadhaa ya habari. Huku Ukraine ikikanusha shutuma hizo  Video hiyo inaonyesha kifaa kinachoruka kikirabia kuba ya jengo la baraza la Seneti katika Kremlin, na kulipuka kabla ya kulifikia. Urusi imeituhumu Ukraine kuishambulia Kremlin kwa droni usiku wa kuamkia Jumatano, katika jaribio lililofeli la kumuuwa Rais Vladmiri Putin, shutuma ambazo Kyiv imekana. Rais Putin hakuwepo Kremlin wakati shambulio hilo likitokea, ambapo msemaji wake Dmitry Peskov ameliambia shirika la habari la serikali ya Urusi Ria Novosti, kwamba rais huyo alikuwa katika makazi yake ya Novo-Ogaryovo, nje ya Moscow. Hata hivyo hakukuwa na uhakiki huru wa shambulio hilo ambalo maafisa wa Urusi wanasema lilitokea usiku lakini bila kuwasilisha ushashidi kuthibitisha madai hayo. Na wala maafisa hao hawakusema kwanini imechukuwa zaidi ya masaa 12 kuripoti tukio hilo. Mshauri wa rais wa Ukraine Mykhailo Podolyask amekanusha ushiriki wowote katika tukio hilo linalodaiwa kuwa ni shutuma kubwa zaidi ambayo Urusi imetoa dhidi ya Ukraine tangu kutuma wanajeshi kuivamia nchi hiyo jirani zaidi ya miezi 14 iliyopita.   Katibu Mtendaji wa Baraza la Mitihani Tanzania (NECTA), Dkt. Said Mohamed Eneo la ajali Bangi Rais wa Jamhuri ya Muungano wa Tanzania Samia Suluhu Hassan, 
 Eneo la ajali Rais wa Jamhuri ya Muungano wa Tanzania Samia Suluhu Hassan, Bangi Katibu Mtendaji wa Baraza la Mitihani Tanzania (NECTA), Dkt. Said Mohamed Nyama ©  East Africa Television Limited. All Rights Reserved"
"
Shambulizi la ndege Ukraine 12 wafariki
","Ijumaa , 28th Apr , 2023",https://www.eatv.tv/news/current-affairs/shambulizi-la-ndege-ukraine-12-wafariki,"  Urusi imerusha makombora katika miji kote nchini Ukraini hii leo na kuua takriban watu 12 katika mashambulio makubwa ya kwanza ya anga katika kipindi cha karibu miezi miwili.  Mashambulizi haya ya asubuhi yalitekelezwa wakati Kyiv inajiandaa kufanya mashambulizi ya kujaribu kulirejesha tena eneo lililokaliwa na Urusi. Katika jiji la kati la Uman, wazima moto walipambana na moto mkali katika jengo la makazi ambalo lilikuwa limeshambuliwa kwenye ghorofa ya juu. Takriban watu 10 waliuawa, wakiwemo watoto wawili, na tisa walipelekwa hospitalini, gavana wa mkoa Ihor Taburets alisema. Mwanaume mtu mzima aliyevalia barakoa aliliakwa uchungu, na mwanamke akaja kumliwaza. ""Mwanzoni madirisha yalilipuliwa, kisha mlipuko mkubwa ukatokea,"" mkazi wa jengo hilo la ghorofa ambaye alijitambulisha kwa jina moja la Olga alisema wakati waokoaji wakiendelea kufukua vifusi. ""Kila kitu kilirushwa nje."" Katibu Mtendaji wa Baraza la Mitihani Tanzania (NECTA), Dkt. Said Mohamed Eneo la ajali Bangi Rais wa Jamhuri ya Muungano wa Tanzania Samia Suluhu Hassan, 
 Eneo la ajali Rais wa Jamhuri ya Muungano wa Tanzania Samia Suluhu Hassan, Bangi Katibu Mtendaji wa Baraza la Mitihani Tanzania (NECTA), Dkt. Said Mohamed Nyama ©  East Africa Television Limited. All Rights Reserved"
"
China na Urusi damu damu, wakutana leo
","Jumatatu , 20th Mar , 2023",https://www.eatv.tv/news/current-affairs/china-na-urusi-damu-damu-wakutana-leo,"  Rais wa China Xi Jinping yuko mjini Moscow kwa ziara ya siku mbili na mazungumzo na Rais wa Urusi Vladimir Putin.     Hii ni ziara ya kwanza ya Xi nchini Urusi tangu wanajeshi wa Urusi walipoivamia Ukraine mwaka 2022. Rais huyo  anatarajiwa kupata chakula cha mchana na Putin baadaye, na kufanya mazungumzo rasmi Jumanne. Ziara hiyo inafanyika siku chache baada ya Mahakama ya Kimataifa ya Uhalifu (ICC) kutoa waranti wa kukamatwa kwa Rais Putin kwa madai ya uhalifu wa kivita. Beijing imeielezea kama ziara ya urafiki na amani, huku Urusi ikisema viongozi hao watajadili ushirikiano kamili na ushirikiano wa kimkakati. Mwezi uliopita Beijing ilitoa mapendekezo ya kumaliza vita nchini Ukraine, ambapo nchi za Magharibi zimetoa mapokezi ya vuguvugu Awali mataifa ya Magharibi yaliionya Beijing dhidi ya kuipatia Moscow silaha. Madai hayo yanakanushwa na china. Katibu Mtendaji wa Baraza la Mitihani Tanzania (NECTA), Dkt. Said Mohamed Eneo la ajali Bangi Rais wa Jamhuri ya Muungano wa Tanzania Samia Suluhu Hassan, 
 Eneo la ajali Rais wa Jamhuri ya Muungano wa Tanzania Samia Suluhu Hassan, Bangi Katibu Mtendaji wa Baraza la Mitihani Tanzania (NECTA), Dkt. Said Mohamed Nyama ©  East Africa Television Limited. All Rights Reserved"
